{
    "candidate_id": "CAND001",
    "job_id": "JD001",
    "application_id": "APP001",
    "score_version": "v1",
    "created_at": "2026-08-17T11:00:00+05:30",
    "model_version": "ats-model-v1.0",
    "scores": {
        "overall_score": 84,
        "skill_match_score": 90,
        "experience_match_score": 80,
        "education_match_score": 85
    },
    "matched_skills": [
        "Python",
        "SQL",
        "FastAPI",
        "Git"
    ],
    "missing_skills": [
        "Django"
    ],
    "recommendation": "Shortlist"
}